{
  "version": "caf.video_reverse_prompt.v1",
  "analysis_id": "smoke-analyzer-core-pack",
  "source_video_relpath": "sandbox/assets/demo/mochi_dance_loop_swap.mp4",
  "truth": {
    "beat_grid_ref": "repo/canon/demo_analyses/smoke-analyzer-core-pack.beat_grid.v1.json",
    "pose_checkpoints_ref": "repo/canon/demo_analyses/smoke-analyzer-core-pack.pose_checkpoints.v1.json",
    "keyframe_checkpoints_ref": "repo/canon/demo_analyses/smoke-analyzer-core-pack.keyframe_checkpoints.v1.json",
    "visual_facts": {
      "camera_movement_mode": "mixed",
      "camera_movement_confidence": 0.58,
      "brightness_bucket": "mid",
      "luma_mean": 134.75,
      "palette_top_hex": [
        "#E8C8A8",
        "#C8A898",
        "#B89888"
      ]
    },
    "shots": [
      {
        "shot_id": "shot_001",
        "start_sec": 0.0,
        "end_sec": 23.68,
        "camera": "mixed",
        "camera_confidence": 0.58,
        "motion_intensity": 0.222,
        "brightness_luma_mean": 134.75,
        "palette_hint": "#E8C8A8"
      }
    ]
  },
  "prompt_packages": {
    "text2video": {
      "prompt": "Locked-camera dance sequence with beat-aligned movement and stable temporal consistency.",
      "negative": [
        "flicker",
        "identity drift",
        "camera shake"
      ]
    },
    "image2video": {
      "prompt": "Preserve key poses at checkpoint timestamps and return to a loop-safe end pose.",
      "negative": [
        "hard jump cuts",
        "background drift",
        "costume mismatch"
      ]
    }
  },
  "confidence": {
    "measured_truth": 0.85,
    "inferred_semantics": 0.6,
    "notes": "beat=librosa_unavailable; scene=scenedetect_unavailable; pose=cv_fallback"
  }
}
